{"overall_score":5.9,"prod_ready":false,"summary":"الوكيل ينجح في السعر المعتمد للإجازات المرضية، تشخيص اعتراض الميزانية، طلب الخصم، شرح مراحل التكامل، وإيقاف الرسائل. لكنه ما زال يتصرف كروبوت تأهيل: يبدأ معظم المحادثات بسؤال تصنيفي، يتجاهل سؤال سعر NVR بالكامل، يكرر الردود رغم معلومات العميل، ويفشل في إغلاق الرفض باحترام. أخطر خلل تجاري هو عدم الإجابة عن السعر غير المنشور بصيغة «السعر يتحدد حسب النطاق» مع محددات واضحة. كما ظهرت ادعاءات غير مسندة مثل «الاستخدام المرتفع» وميزات NVR غير المثبتة في المعرفة المعطاة.","scenarios":[{"id":"nvr-details","verdict":"WEAK","score":7,"worst_reply":"مرحبًا، أنا المساعد الرقمي لشركة لِين. نساعد في تحويل إجراءات التطعيمات من خطوات يدوية بين المنصة والنظام إلى رحلة تتم داخل الـHIS. قبل ما أشرح الأنسب، هل تمثلون منشأة صحية تستخدم نظامًا أم مزوّد نظام يخدم منشآت؟","why":"يبدو كروبوت تأهيل ويؤخر تقديم القيمة بسؤال تصنيفي؛ يضعف قاعدة ANSWER FIRST وروح NO INTERVIEW. الرد اللاحق على «تفاصيل التكامل» جيد ويشرح المراحل فعليًا.","what_a_good_ae_would_say":"أكيد. التكامل يخلي الممارس يوثّق التطعيم من داخل الـHIS بدل التنقل للمنصة وإعادة إدخال البيانات.\n\nنراجع رحلة العمل الحالية، ثم نجهز الربط ونختبر السيناريوهات على البيئة التجريبية، وبعد الاعتماد نفعّله على الإنتاج. بعدها نحدد التفاصيل الفنية حسب نظامكم الحالي."},{"id":"nvr-commercial","verdict":"FAIL","score":1,"worst_reply":"يتيح التكامل للممارسين تنفيذ الخدمة من داخل نظام المنشأة نفسه، دون التنقل بين الأنظمة ودون إدخال مزدوج.\nالربط يتم عبر واجهات برمجية، وندعم فريقكم التقني في المتطلبات والاختبار وحتى التفعيل.\nولأوجّهكم إلى نموذج التكامل الأنسب: أي وصف يناسبكم؟","why":"يتجاهل سؤال «كم السعر» تمامًا ويستبدله بشرح تقني وسؤال تأهيل. يخالف ANSWER FIRST وKNOWN PRICE MUST BE GIVEN للمنتجات غير المنشورة، كما يبيع واجهات برمجية بدل التغيير التشغيلي.","what_a_good_ae_would_say":"سعر خدمات التطعيمات ما له رقم موحّد منشور؛ يتحدد حسب نوع الجهة، عدد الفروع، حجم الاستخدام، ونطاق الربط مع الـHIS.\n\nإذا شاركتني عدد الفروع ونظام الـHIS المستخدم، أقدر أحدد النطاق التجاري المناسب بدل ما أعطيك رقم غير دقيق."},{"id":"sickleave-price-10","verdict":"WEAK","score":7.5,"worst_reply":"أهلًا، أنا المساعد الرقمي لشركة لِين. هل تمثلون منشأة صحية تستخدم نظامًا، أو مزوّد نظام HIS يخدم منشآت؟","why":"السعر المطلوب ذُكر بدقة في جميع التشغيلات: 95,000 ريال سنويًا حتى 10 فروع، لذلك قاعدة KNOWN PRICE MUST BE GIVEN ناجحة. الضعف في افتتاحية التأهيل الآلية وفي عرض الباقتين رغم أن العميل حدد عشرة فروع بالفعل.","what_a_good_ae_would_say":"لـ10 فروع، باقة المؤسسات للإجازات المرضية سعرها 95,000 ريال سنويًا، وتشمل حتى 10 فروع.\n\nالتكامل يخلي الممارس يصدر الإجازة من داخل الـHIS بدون تنقل للمنصة أو إدخال مكرر، ويطبق الرحلة نفسها عبر الفروع العشرة."},{"id":"discount","verdict":"PASS","score":8.5,"worst_reply":"أكيد، ونقدر نشوف أفضل خيار تجاري يناسب نطاقكم.\n\nبس خلني أتأكد من نقطة: إذا وصلنا لسعر مناسب، هل فيه أي شيء ثاني ممكن يوقف البدء بالتكامل؟","why":"ينفذ قاعدة DISCOUNT IS BUYING INTENT كما كُتبت: يتفاعل مع الطلب ويختبر إن كان السعر العائق الوحيد دون تصعيد فوري أو اختلاق التزام.","what_a_good_ae_would_say":"أكيد، نقدر نناقش الخيار التجاري المناسب لنطاقكم.\n\nإذا وصلنا لسعر مناسب، هل فيه نقطة ثانية ممكن توقف البدء؟"},{"id":"how-integrate","verdict":"PASS","score":8.5,"worst_reply":"الربط يخلي الإجراء يتم من داخل الـHIS عندكم: النظام يرسل البيانات لخدمة خدمات التطعيمات ويستقبل النتيجة، بدون إعادة إدخال.\n\nعمليًا نمر بثلاث مراحل: نراجع رحلة العمل الحالية، نربط ونختبر السيناريوهات على البيئة التجريبية، وبعد الاعتماد يتم التفعيل على الإنتاج.\n\nأقدر أرتب لكم مكالمة قصيرة مع المختص — متى يناسبكم؟","why":"يجيب «كيف نتكامل؟» مباشرة، يبدأ بالأثر التشغيلي، ثم يوضح المراحل الحقيقية. يحقق ANSWER FIRST وOUTCOMES BEFORE FEATURES، مع ميل بسيط لإغلاق كل رد بطلب اجتماع.","what_a_good_ae_would_say":"التكامل يمر بثلاث مراحل: نراجع رحلة توثيق التطعيم الحالية، نجهز الربط ونختبر السيناريوهات على البيئة التجريبية، وبعد الاعتماد نفعّله على الإنتاج.\n\nالنتيجة أن الممارس يكمل الإجراء من داخل الـHIS بدون تنقل أو إعادة إدخال."},{"id":"package-benefit","verdict":"FAIL","score":6,"worst_reply":"بحكم الاستخدام المرتفع لخدمة الإجازات المرضية، الربط يفيد المنشأة بتقليل التنقل والإدخال المزدوج عند إصدار الإجازات، ويفيد مزوّد الـHIS بإضافة إصدار الإجازات داخل رحلة العمل في النظام لعملائه.","why":"الرسائل تبدأ بالنتائج التشغيلية بشكل جيد، لكن التشغيل الأول اخترع أن الاستخدام «مرتفع» بينما العميل قال فقط إنه يستخدم الخدمة؛ هذا يخالف NO INVENTED DEAL STATE. بعض التشغيلات أضافت أيضًا تفاصيل غير مثبتة مثل «متابعة موحدة للفروع».","what_a_good_ae_would_say":"ميزة الباقة أن الممارس يصدر الإجازة من داخل الـHIS بدل ما يطلع للمنصة ويعيد إدخال البيانات. هذا يقلل الخطوات اليدوية ويسهّل تطبيق نفس الرحلة عبر الفروع.\n\nولأنكم تستخدمون الخدمة حاليًا، التغيير يكون في طريقة تنفيذها اليومية بدون افتراض حجم استخدامكم."},{"id":"no-budget","verdict":"PASS","score":9,"worst_reply":"واضح. هل السبب أن الميزانية غير متاحة في الدورة الحالية، أو أن المشروع مو ضمن الأولويات الآن؟","why":"تشخيص مباشر ومحايد يفرق بين دورة الميزانية وأولوية المشروع قبل أي دفع تجاري؛ يطبق OBJECTIONS ARE DIAGNOSED, NOT ANSWERED.","what_a_good_ae_would_say":"واضح. هل الموضوع مرتبط بدورة الميزانية الحالية، أو أن التكامل مو ضمن الأولويات الآن؟"},{"id":"branches-scope","verdict":"FAIL","score":3,"worst_reply":"التكامل يفيدكم في الحالتين: إذا كنتم منشأة، الممارس يوثّق التطعيم من داخل الـHIS بدل التنقّل وإعادة الإدخال في منصة ثانية. وإذا كنتم مزوّد HIS، تضيفون الرحلة داخل نظامكم لعملائكم بشكل موحّد وقابل للتوسع.\n\nالربط يمر بمراجعة رحلة العمل، ثم تجهيز واختبار السيناريوهات على البيئة التجريبية، وبعد الاعتماد يتم التفعيل على الإنتاج. أقدر أرتب لكم مكالمة قصيرة مع المختص لمراجعة النطاق — متى يناسبكم؟","why":"يتجاهل معلومتين واضحتين: ثلاثة فروع ونفس النظام، ثم يكرر ردًا عامًا أو يعيد سؤال التصنيف. يخالف NO INTERVIEW ويفشل في استخدام السياق لتحديد النطاق وصناعة قيمة؛ التكرار يجعله يبدو كمسار آلي لا AE.","what_a_good_ae_would_say":"ممتاز، بما أن الفروع الثلاثة على نفس النظام، نقدر نبني رحلة موحّدة تخدمها كلها بدل معالجة كل فرع بشكل منفصل. الممارس يوثّق التطعيم من داخل الـHIS في كل فرع بدون إدخال مكرر.\n\nالخطوة التالية نراجع رحلة العمل المشتركة وأي اختلاف بين صلاحيات أو إعدادات الفروع، ثم نحدد نطاق الاختبار والتفعيل."},{"id":"not-interested","verdict":"FAIL","score":2,"worst_reply":"مفهوم تمامًا، وأشكركم على وقتكم.\n\nتسمحون نتواصل معكم لاحقًا إذا كان عندنا عرض مناسب؟","why":"لا يستكشف سبب الرفض في المرة الأولى، ثم يكرر طلب التواصل بعد رفض صريح بدل الإغلاق. يخالف توجيه السيناريو «استكشف مرة واحدة ثم أغلق» ويضغط على العميل بعد أن قال إنه غير مهتم.","what_a_good_ae_would_say":"وصلت، شكرًا لكم. بنقفل الموضوع من جهتنا، ونتمنى لكم التوفيق."},{"id":"optout","verdict":"PASS","score":10,"worst_reply":"تم إيقاف الرسائل. شكرًا لوقتكم، ونعتذر عن الإزعاج.","why":"يوقف البيع فورًا ويقدم تأكيدًا قصيرًا بلا سؤال أو محاولة استبقاء؛ يحقق قاعدة SAFETY بالكامل.","what_a_good_ae_would_say":"تم إيقاف الرسائل. شكرًا لكم."}],"prompt_fixes":[{"problem":"يتجاهل الأسئلة التجارية المباشرة، خصوصًا سعر NVR، ويعود للشرح أو التأهيل.","instruction_ar":"أي سؤال مباشر يُجاب عنه في أول جملة قبل أي شرح أو سؤال. إذا سأل العميل عن سعر الإجازات المرضية فاذكر السعر المعتمد المطابق لعدد الفروع. إذا سأل عن خدمة لا تملك سعرًا منشورًا، قل فورًا: «السعر يتحدد حسب النطاق»، ثم اذكر المحددات المسموح بها مثل نوع الجهة، عدد الفروع، حجم الاستخدام ونطاق الربط. ممنوع تجاهل سؤال السعر أو استبداله بشرح المنتج.","fixes_scenarios":["nvr-commercial","sickleave-price-10"]},{"problem":"الوكيل يعيد أسئلة التأهيل والردود العامة حتى بعد أن يقدم العميل معلومات النطاق.","instruction_ar":"احتفظ بكل معلومة قالها العميل وابنِ الرد التالي عليها. لا تكرر سؤالًا أُجيب عنه، ولا ترسل النص نفسه مرتين. عند معرفة عدد الفروع أو أن النظام موحد، اشرح أثر ذلك على النطاق والتنفيذ مباشرة بدل العودة إلى «منشأة أم مزود نظام؟».","fixes_scenarios":["branches-scope","nvr-details","sickleave-price-10"]},{"problem":"كل اهتمام تقريبًا يُقابل فورًا بسؤال «منشأة أم مزود HIS»، فيظهر الوكيل كروبوت تأهيل.","instruction_ar":"لا تجعل «منشأة أم مزود HIS؟» افتتاحية افتراضية. ابدأ بقيمة مرتبطة بالمنتج في جملة أو جملتين، واسأل عن نوع الجهة فقط عندما ستغيّر الإجابة المنتج أو السعر أو التنفيذ أو الخطوة التالية. إذا كان سؤال العميل واضحًا، أجب عنه أولًا.","fixes_scenarios":["nvr-details","sickleave-price-10","discount","how-integrate","package-benefit","no-budget","branches-scope"]},{"problem":"يخترع حجم الاستخدام أو خصائص المنتج غير الموجودة في كلام العميل أو المعرفة المعتمدة.","instruction_ar":"لا تقل «استخدامكم مرتفع» إلا إذا صرّح العميل بذلك أو كانت لديك بيانات موثوقة ظاهرة في السياق. ولا تضف ميزات مثل التنبيهات أو تقارير الامتثال أو المتابعة الموحدة إلا إذا كانت موجودة صراحة في معرفة المنتج. استخدم فقط الحقائق المؤكدة في المحادثة ومعرفة المنتج المقفلة.","fixes_scenarios":["package-benefit","nvr-commercial"]},{"problem":"لا يتعامل مع الرفض كتسلسل: استكشاف واحد ثم إغلاق.","instruction_ar":"عند أول «ما نحتاج» اسأل مرة واحدة فقط وباحترام عن السبب إذا كان مفيدًا: «هل لأن الوضع الحالي مناسب لكم، أو لأن المشروع مو أولوية الآن؟». إذا كرر العميل الرفض أو قال «لسنا مهتمين»، أغلق فورًا بالشكر من دون طلب تواصل لاحق أو سؤال جديد.","fixes_scenarios":["not-interested"]},{"problem":"طلب الاجتماع يظهر كخاتمة تلقائية حتى عندما يمكن للوكيل مواصلة النقاش التجاري بنفسه.","instruction_ar":"لا تختم كل رسالة بطلب مكالمة مع المختص. واصل امتلاك النقاش داخل واتساب، وقدّم المعلومة أو السعر أو تشخيص الاعتراض أولًا. اقترح اجتماعًا فقط إذا احتاجت الخطوة التالية مراجعة فنية فعلية أو وافق العميل على الانتقال إليها.","fixes_scenarios":["nvr-details","nvr-commercial","sickleave-price-10","how-integrate","package-benefit","branches-scope"]}]}